{
  "$schema": "./visual-targets.canonical.schema.json",
  "version": "1.0.0",
  "owner": "claude-w15-a8-registry",
  "created": "2026-05-10",
  "tolerance_default": 0.1,
  "reference_viewport": "1536x1024",
  "viewport": { "width": 1536, "height": 1024 },
  "themes": ["default", "cyberpunk", "matrix", "tron", "industrial_forge", "aurora_operator"],
  "description": "Canonical W15-A8 visual target registry: every PNG in Images-GUI/ maps to at least one target. Collage PNGs expand into a parent + N region children. The 09-themes palette reference additionally expands into 6 theme-variant siblings. Per-target viewport reflects the actual PNG dimensions (1672x941 and 1586x992 outliers are explicit overrides on top of the 1536x1024 default).",
  "targets": [
    {
      "target_id": "00_user_hermes3d",
      "image_path": "Images-GUI/00-user-current-downloads/Hermes3D.png",
      "dimensions": { "width": 1536, "height": 1024 },
      "route": "/",
      "viewport": { "width": 1536, "height": 1024 },
      "theme": "dark",
      "ui_state": "default",
      "crop_region": null,
      "backend_truth_source": "/api/dashboard/summary",
      "playwright_proof_screenshot": "tests/visual/__snapshots__/00_user_hermes3d.png",
      "pass_fail_status": "not-yet-run",
      "owning_pr": null,
      "final_verdict": "pending",
      "class": "single",
      "live_or_future": "live",
      "tolerance": 0.15,
      "wait_test_id": "dashboard-root",
      "notes": "User-approved baseline of the app shell at default route."
    },
    {
      "target_id": "00_user_generated_1",
      "image_path": "Images-GUI/00-user-current-downloads/Generated image 1.png",
      "dimensions": { "width": 1672, "height": 941 },
      "route": "/#dashboard",
      "viewport": { "width": 1672, "height": 941 },
      "theme": "dark",
      "ui_state": "default",
      "crop_region": null,
      "backend_truth_source": null,
      "playwright_proof_screenshot": "tests/visual/__snapshots__/00_user_generated_1.png",
      "pass_fail_status": "skipped",
      "owning_pr": null,
      "final_verdict": "deferred",
      "class": "user_direction",
      "live_or_future": "future",
      "tolerance": 0.2,
      "wait_test_id": "dashboard-root",
      "notes": "Direction PNG (1672x941), not a 1:1 page snapshot. Tracked for visual direction only."
    },
    {
      "target_id": "00_user_generated_2",
      "image_path": "Images-GUI/00-user-current-downloads/Generated image 2.png",
      "dimensions": { "width": 1672, "height": 941 },
      "route": "/#dashboard",
      "viewport": { "width": 1672, "height": 941 },
      "theme": "dark",
      "ui_state": "default",
      "crop_region": null,
      "backend_truth_source": null,
      "playwright_proof_screenshot": "tests/visual/__snapshots__/00_user_generated_2.png",
      "pass_fail_status": "skipped",
      "owning_pr": null,
      "final_verdict": "deferred",
      "class": "user_direction",
      "live_or_future": "future",
      "tolerance": 0.2,
      "wait_test_id": "dashboard-root",
      "notes": "Direction PNG (1672x941)."
    },
    {
      "target_id": "00_user_generated_3",
      "image_path": "Images-GUI/00-user-current-downloads/Generated image 3.png",
      "dimensions": { "width": 1536, "height": 1024 },
      "route": "/#dashboard",
      "viewport": { "width": 1536, "height": 1024 },
      "theme": "dark",
      "ui_state": "default",
      "crop_region": null,
      "backend_truth_source": null,
      "playwright_proof_screenshot": "tests/visual/__snapshots__/00_user_generated_3.png",
      "pass_fail_status": "skipped",
      "owning_pr": null,
      "final_verdict": "deferred",
      "class": "user_direction",
      "live_or_future": "future",
      "tolerance": 0.2,
      "wait_test_id": "dashboard-root",
      "notes": "Direction PNG."
    },
    {
      "target_id": "00_user_generated_4",
      "image_path": "Images-GUI/00-user-current-downloads/Generated image 4.png",
      "dimensions": { "width": 1536, "height": 1024 },
      "route": "/#dashboard",
      "viewport": { "width": 1536, "height": 1024 },
      "theme": "dark",
      "ui_state": "default",
      "crop_region": null,
      "backend_truth_source": null,
      "playwright_proof_screenshot": "tests/visual/__snapshots__/00_user_generated_4.png",
      "pass_fail_status": "skipped",
      "owning_pr": null,
      "final_verdict": "deferred",
      "class": "user_direction",
      "live_or_future": "future",
      "tolerance": 0.2,
      "wait_test_id": "dashboard-root",
      "notes": "Direction PNG."
    },
    {
      "target_id": "00_user_generated_5",
      "image_path": "Images-GUI/00-user-current-downloads/Generated image 5.png",
      "dimensions": { "width": 1536, "height": 1024 },
      "route": "/#dashboard",
      "viewport": { "width": 1536, "height": 1024 },
      "theme": "dark",
      "ui_state": "default",
      "crop_region": null,
      "backend_truth_source": null,
      "playwright_proof_screenshot": "tests/visual/__snapshots__/00_user_generated_5.png",
      "pass_fail_status": "skipped",
      "owning_pr": null,
      "final_verdict": "deferred",
      "class": "user_direction",
      "live_or_future": "future",
      "tolerance": 0.2,
      "wait_test_id": "dashboard-root",
      "notes": "Direction PNG."
    },
    {
      "target_id": "00_user_generated_6",
      "image_path": "Images-GUI/00-user-current-downloads/Generated image 6.png",
      "dimensions": { "width": 1536, "height": 1024 },
      "route": "/#dashboard",
      "viewport": { "width": 1536, "height": 1024 },
      "theme": "dark",
      "ui_state": "default",
      "crop_region": null,
      "backend_truth_source": null,
      "playwright_proof_screenshot": "tests/visual/__snapshots__/00_user_generated_6.png",
      "pass_fail_status": "skipped",
      "owning_pr": null,
      "final_verdict": "deferred",
      "class": "user_direction",
      "live_or_future": "future",
      "tolerance": 0.2,
      "wait_test_id": "dashboard-root",
      "notes": "Direction PNG."
    },
    {
      "target_id": "00_user_generated_7",
      "image_path": "Images-GUI/00-user-current-downloads/Generated image 7.png",
      "dimensions": { "width": 1536, "height": 1024 },
      "route": "/#dashboard",
      "viewport": { "width": 1536, "height": 1024 },
      "theme": "dark",
      "ui_state": "default",
      "crop_region": null,
      "backend_truth_source": null,
      "playwright_proof_screenshot": "tests/visual/__snapshots__/00_user_generated_7.png",
      "pass_fail_status": "skipped",
      "owning_pr": null,
      "final_verdict": "deferred",
      "class": "user_direction",
      "live_or_future": "future",
      "tolerance": 0.2,
      "wait_test_id": "dashboard-root",
      "notes": "Direction PNG."
    },
    {
      "target_id": "00_user_generated_8",
      "image_path": "Images-GUI/00-user-current-downloads/Generated image 8.png",
      "dimensions": { "width": 1536, "height": 1024 },
      "route": "/#dashboard",
      "viewport": { "width": 1536, "height": 1024 },
      "theme": "dark",
      "ui_state": "default",
      "crop_region": null,
      "backend_truth_source": null,
      "playwright_proof_screenshot": "tests/visual/__snapshots__/00_user_generated_8.png",
      "pass_fail_status": "skipped",
      "owning_pr": null,
      "final_verdict": "deferred",
      "class": "user_direction",
      "live_or_future": "future",
      "tolerance": 0.2,
      "wait_test_id": "dashboard-root",
      "notes": "Direction PNG."
    },
    {
      "target_id": "00_user_generated_9",
      "image_path": "Images-GUI/00-user-current-downloads/Generated image 9.png",
      "dimensions": { "width": 1536, "height": 1024 },
      "route": "/#dashboard",
      "viewport": { "width": 1536, "height": 1024 },
      "theme": "dark",
      "ui_state": "default",
      "crop_region": null,
      "backend_truth_source": null,
      "playwright_proof_screenshot": "tests/visual/__snapshots__/00_user_generated_9.png",
      "pass_fail_status": "skipped",
      "owning_pr": null,
      "final_verdict": "deferred",
      "class": "user_direction",
      "live_or_future": "future",
      "tolerance": 0.2,
      "wait_test_id": "dashboard-root",
      "notes": "Direction PNG."
    },
    {
      "target_id": "01_dashboard_advanced_a",
      "image_path": "Images-GUI/01-dashboard-modes/advanced-dashboard-a.png",
      "dimensions": { "width": 1536, "height": 1024 },
      "route": "/#dashboard:advanced",
      "viewport": { "width": 1536, "height": 1024 },
      "theme": "dark",
      "ui_state": "default",
      "crop_region": null,
      "backend_truth_source": "/api/dashboard/summary",
      "playwright_proof_screenshot": "tests/visual/__snapshots__/01_dashboard_advanced_a.png",
      "pass_fail_status": "not-yet-run",
      "owning_pr": null,
      "final_verdict": "pending",
      "class": "single",
      "live_or_future": "live",
      "tolerance": 0.1,
      "wait_test_id": "dashboard-root",
      "notes": "Advanced dashboard mode primary view A. Owned by W6-3."
    },
    {
      "target_id": "01_dashboard_advanced_b",
      "image_path": "Images-GUI/01-dashboard-modes/advanced-dashboard-b.png",
      "dimensions": { "width": 1536, "height": 1024 },
      "route": "/#dashboard:advanced",
      "viewport": { "width": 1536, "height": 1024 },
      "theme": "dark",
      "ui_state": "default",
      "crop_region": null,
      "backend_truth_source": "/api/dashboard/summary",
      "playwright_proof_screenshot": "tests/visual/__snapshots__/01_dashboard_advanced_b.png",
      "pass_fail_status": "not-yet-run",
      "owning_pr": null,
      "final_verdict": "pending",
      "class": "single",
      "live_or_future": "future",
      "tolerance": 0.1,
      "wait_test_id": "dashboard-root",
      "notes": "Advanced dashboard alt view B."
    },
    {
      "target_id": "01_dashboard_simple_a",